{
 "schema": "treesight/extract@1",
 "session": "706417bf-867e-53bc-8972-5355a66002dc",
 "through": "3c4f8483-0fb9-5dcc-9915-a4c993d0e314",
 "nodes": [
  {
   "ref": "n1",
   "kind": "done",
   "label": "照片上传做好了",
   "line": "每个菜谱页有了「上传照片」按钮，照片显示在最上面，另加了 4 个测试。",
   "score": 4,
   "twigs": [
    "每个菜谱一张照片",
    "4 个上传测试"
   ],
   "at": "2026-09-14T09:19:45.000Z",
   "msg": "fbf2632c-df2b-5385-bde1-4e9138fa06ca",
   "evidence": [
    {
     "quote": "照片上传做好了。每个菜谱页现在有一个「上传照片」按钮，照片显示在菜谱最上面。",
     "kind": "reply",
     "msg": "fbf2632c-df2b-5385-bde1-4e9138fa06ca",
     "at": "2026-09-14T09:19:45.000Z",
     "twig": 0
    }
   ]
  },
  {
   "ref": "n2",
   "kind": "done",
   "label": "手机照片能上传了",
   "line": "手机照片一直传不上去，直到服务器和应用自己的两处 1 MB 限制都调到 10 MB。",
   "score": 5,
   "twigs": [
    "服务器上限 10 MB",
    "应用上限 10 MB",
    "6 MB 照片测试"
   ],
   "story": {
    "minutes": 87,
    "q": "about",
    "basis": "从第一次上传失败到传上去",
    "steps": [
     {
      "role": "stuck",
      "text": "手机照片上传失败，只显示「上传失败」；小测试图片可以。",
      "at": "2026-09-14T09:41:12.000Z",
      "at_q": "exact"
     },
     {
      "role": "response",
      "text": "先调高服务器的上限，又把应用自己的 1 MB 限制也调到 10 MB。",
      "at": "2026-09-14T10:52:37.000Z",
      "at_q": "exact"
     },
     {
      "role": "result",
      "text": "手机上一张 6 MB 的照片传上去了。",
      "at": "2026-09-14T11:08:20.000Z",
      "at_q": "exact"
     }
    ]
   },
   "at": "2026-09-14T11:08:20.000Z",
   "msg": "3fcb5014-b21a-5a1a-ab48-653e00cdd0b1",
   "evidence": [
    {
     "quote": "用手机传照片失败了。",
     "kind": "prompt",
     "msg": "17c5f062-e104-5927-8f63-c52b2e1cefe4",
     "at": "2026-09-14T09:41:12.000Z"
    },
    {
     "quote": "找到第二处限制了：应用本身也把上传限制在 1 MB。",
     "kind": "reply",
     "msg": "4f2d601b-1356-5fd6-96b5-49fa93cf0f09",
     "at": "2026-09-14T10:52:37.000Z",
     "twig": 1
    },
    {
     "quote": "这下可以了。手机上一张 6 MB 的照片传上去了。",
     "kind": "prompt",
     "msg": "3fcb5014-b21a-5a1a-ab48-653e00cdd0b1",
     "at": "2026-09-14T11:08:20.000Z",
     "twig": 2
    }
   ]
  },
  {
   "ref": "n3",
   "kind": "found",
   "label": "旋转方向单独存储",
   "line": "手机把旋转方向单独存成标记、不转动像素，页面又忽略了它，所以照片是横的。",
   "score": 3,
   "at": "2026-09-14T11:22:48.000Z",
   "msg": "9cfda2a9-a492-5b9a-b7fe-e4d53e22903f",
   "evidence": [
    {
     "quote": "手机把旋转方向单独存成一个标记，并没有真的转动像素，而页面忽略了这个标记。",
     "kind": "reply",
     "msg": "9cfda2a9-a492-5b9a-b7fe-e4d53e22903f",
     "at": "2026-09-14T11:22:48.000Z"
    }
   ]
  },
  {
   "ref": "n4",
   "kind": "done",
   "label": "照片能正着显示了",
   "line": "每张照片上传时都会先转正，你也确认过了。",
   "score": 3,
   "at": "2026-09-14T11:30:10.000Z",
   "msg": "fde1a279-cd7f-5118-8ec6-a1429befbb58",
   "evidence": [
    {
     "quote": "现在每张照片上传时我都会先转正。",
     "kind": "reply",
     "msg": "9cfda2a9-a492-5b9a-b7fe-e4d53e22903f",
     "at": "2026-09-14T11:22:48.000Z"
    },
    {
     "quote": "好了，现在是正的。",
     "kind": "prompt",
     "msg": "fde1a279-cd7f-5118-8ec6-a1429befbb58",
     "at": "2026-09-14T11:30:10.000Z"
    }
   ]
  }
 ],
 "open": [
  {
   "ref": "o1",
   "kind": "wait",
   "label": "老周的存储密钥",
   "line": "老周说这周发来照片存储桶的密钥；在那之前照片先存在服务器硬盘上。",
   "who": "老周",
   "rank": 3,
   "raised_at": "2026-09-14T11:40:05.000Z",
   "msg": "f016a655-ea7d-5142-a970-43e9ebdc5142",
   "evidence": [
    {
     "quote": "照片存储桶的密钥在老周那儿。我早上问过他，他说这周发给我。",
     "kind": "prompt",
     "msg": "f016a655-ea7d-5142-a970-43e9ebdc5142",
     "at": "2026-09-14T11:40:05.000Z"
    }
   ]
  },
  {
   "ref": "o2",
   "kind": "wait",
   "label": "小雨对排版的反馈",
   "line": "小雨在用手机看新的照片排版，发布要等她的反馈。",
   "who": "小雨",
   "rank": 2,
   "raised_at": "2026-09-14T11:52:44.000Z",
   "msg": "141df939-a8ea-5ef7-8b64-3518fc2ad46f",
   "evidence": [
    {
     "quote": "小雨在用她的手机看新的照片排版。我等她的反馈再发布。",
     "kind": "prompt",
     "msg": "141df939-a8ea-5ef7-8b64-3518fc2ad46f",
     "at": "2026-09-14T11:52:44.000Z"
    }
   ]
  },
  {
   "ref": "o3",
   "kind": "todo",
   "label": "发布照片上传功能",
   "line": "带照片上传的版本要等小雨对排版的反馈再发布。",
   "blocked_by": "o2",
   "rank": 4,
   "raised_at": "2026-09-14T11:52:44.000Z",
   "msg": "141df939-a8ea-5ef7-8b64-3518fc2ad46f",
   "evidence": [
    {
     "quote": "我等她的反馈再发布。",
     "kind": "prompt",
     "msg": "141df939-a8ea-5ef7-8b64-3518fc2ad46f",
     "at": "2026-09-14T11:52:44.000Z"
    },
    {
     "quote": "明白：发布要等小雨对排版的反馈。",
     "kind": "reply",
     "msg": "b9759dc4-8c7c-5e01-ba0c-3803bed381c8",
     "at": "2026-09-14T11:53:20.000Z"
    }
   ]
  },
  {
   "ref": "o4",
   "kind": "wait",
   "label": "上线后再压缩照片",
   "line": "保存前压缩照片这件事，你推到了上线以后。",
   "when": "上线以后",
   "raised_at": "2026-09-14T12:01:09.000Z",
   "msg": "1fd08501-9091-585f-b015-1ff1ae76a7b3",
   "evidence": [
    {
     "quote": "保存前把照片压小一点会更好，不过等上线以后再说吧。",
     "kind": "prompt",
     "msg": "1fd08501-9091-585f-b015-1ff1ae76a7b3",
     "at": "2026-09-14T12:01:09.000Z"
    }
   ]
  },
  {
   "ref": "o5",
   "kind": "todo",
   "label": "报名沙龙演示",
   "line": "你想在 9 月 20 日的技术沙龙上演示 recipe-box，打算这周报名。",
   "due": "2026-09-20",
   "rank": 1,
   "raised_at": "2026-09-14T12:10:33.000Z",
   "msg": "d84421d5-c004-53ea-9aa1-df1b9f930cf8",
   "evidence": [
    {
     "quote": "我想在 9 月 20 日的技术沙龙上演示 recipe-box。这周我去报名一个演示名额。",
     "kind": "prompt",
     "msg": "d84421d5-c004-53ea-9aa1-df1b9f930cf8",
     "at": "2026-09-14T12:10:33.000Z"
    }
   ]
  },
  {
   "ref": "o6",
   "kind": "todo",
   "label": "删菜谱也删照片",
   "line": "删除菜谱时也要删掉它的照片，还没做。",
   "rank": 5,
   "raised_at": "2026-09-14T12:18:47.000Z",
   "msg": "7e16ae8f-b4b8-5209-b3d1-9611efd4b3ec",
   "evidence": [
    {
     "quote": "删除菜谱的时候应该把它的照片也删掉。",
     "kind": "prompt",
     "msg": "7e16ae8f-b4b8-5209-b3d1-9611efd4b3ec",
     "at": "2026-09-14T12:18:47.000Z"
    },
    {
     "quote": "这个还没做。",
     "kind": "reply",
     "msg": "3c4f8483-0fb9-5dcc-9915-a4c993d0e314",
     "at": "2026-09-14T12:19:20.000Z"
    }
   ]
  }
 ],
 "close": []
}
