{
 "schema": "treesight/extract@1",
 "session": "0c4f931d-e9a4-580f-989d-08dc086e7f1e",
 "through": "3829adda-bb4b-5fbb-8ec7-05355c5c4674",
 "nodes": [
  {
   "ref": "n1",
   "kind": "done",
   "label": "Photo upload added",
   "line": "Each recipe page got an Upload photo button, with the photo shown at the top of the recipe and 4 new tests.",
   "score": 4,
   "twigs": [
    "One photo per recipe",
    "4 new upload tests"
   ],
   "at": "2026-09-14T09:19:45.000Z",
   "msg": "cb955082-2960-5a1d-85fb-06a819120364",
   "evidence": [
    {
     "quote": "Photo upload is in. Each recipe page now has an Upload photo button, and the photo shows at the top of the recipe.",
     "kind": "reply",
     "msg": "cb955082-2960-5a1d-85fb-06a819120364",
     "at": "2026-09-14T09:19:45.000Z"
    }
   ]
  },
  {
   "ref": "n2",
   "kind": "done",
   "label": "Phone photos upload fine",
   "line": "Photos from your phone failed until two 1 MB limits, the web server's and the app's own, went up to 10 MB.",
   "score": 5,
   "twigs": [
    "Server limit: 10 MB",
    "App limit: 10 MB",
    "Test with a 6 MB photo"
   ],
   "story": {
    "minutes": 87,
    "q": "about",
    "basis": "first failed upload to the working one",
    "steps": [
     {
      "role": "stuck",
      "text": "Photos from your phone failed with Upload failed; small test images worked.",
      "at": "2026-09-14T09:41:12.000Z",
      "at_q": "exact"
     },
     {
      "role": "response",
      "text": "Raised the web server's limit, then the app's own 1 MB cap, to 10 MB.",
      "at": "2026-09-14T10:52:37.000Z",
      "at_q": "exact"
     },
     {
      "role": "result",
      "text": "A 6 MB photo from your phone uploaded fine.",
      "at": "2026-09-14T11:08:20.000Z",
      "at_q": "exact"
     }
    ]
   },
   "at": "2026-09-14T11:08:20.000Z",
   "msg": "bbced6e4-2076-520f-8de1-dfa6d06478bc",
   "evidence": [
    {
     "quote": "Uploading a photo from my phone fails.",
     "kind": "prompt",
     "msg": "06eccbdd-3142-5708-89e8-7b373be39359",
     "at": "2026-09-14T09:41:12.000Z"
    },
    {
     "quote": "Found a second limit: the app itself also capped uploads at 1 MB.",
     "kind": "reply",
     "msg": "11c8df04-30d2-5624-8e6f-685fae57740f",
     "at": "2026-09-14T10:52:37.000Z"
    },
    {
     "quote": "Works now. A 6 MB photo from my phone uploaded fine.",
     "kind": "prompt",
     "msg": "bbced6e4-2076-520f-8de1-dfa6d06478bc",
     "at": "2026-09-14T11:08:20.000Z"
    }
   ]
  },
  {
   "ref": "n3",
   "kind": "found",
   "label": "Phones store photo rotation separately",
   "line": "Phones save the rotation as a separate tag instead of turning the pixels, and the page ignored it, so photos showed sideways.",
   "score": 3,
   "at": "2026-09-14T11:22:48.000Z",
   "msg": "98b53c9d-4a57-5e75-bbe0-95801b2c13d8",
   "evidence": [
    {
     "quote": "Phones save the rotation as a separate tag instead of turning the pixels, and the page ignored that tag.",
     "kind": "reply",
     "msg": "98b53c9d-4a57-5e75-bbe0-95801b2c13d8",
     "at": "2026-09-14T11:22:48.000Z"
    }
   ]
  },
  {
   "ref": "n4",
   "kind": "done",
   "label": "Photos show the right way up",
   "line": "Each photo is now turned the right way up when it is uploaded, and you checked it.",
   "score": 3,
   "at": "2026-09-14T11:30:10.000Z",
   "msg": "9edc827f-4f47-557d-9743-908706e7310d",
   "evidence": [
    {
     "quote": "I now turn each photo the right way up when it is uploaded.",
     "kind": "reply",
     "msg": "98b53c9d-4a57-5e75-bbe0-95801b2c13d8",
     "at": "2026-09-14T11:22:48.000Z"
    },
    {
     "quote": "Perfect, it's the right way up now.",
     "kind": "prompt",
     "msg": "9edc827f-4f47-557d-9743-908706e7310d",
     "at": "2026-09-14T11:30:10.000Z"
    }
   ]
  }
 ],
 "open": [
  {
   "ref": "o1",
   "kind": "wait",
   "label": "Storage keys from Sam",
   "line": "Sam said he would send the keys for the photo storage bucket this week; until then photos stay on the server's disk.",
   "who": "Sam",
   "rank": 3,
   "raised_at": "2026-09-14T11:40:05.000Z",
   "msg": "9b54825a-f432-5da2-9af3-f0de0547e28a",
   "evidence": [
    {
     "quote": "Sam has the keys for the photo storage bucket. I asked him this morning and he said he'd send them this week.",
     "kind": "prompt",
     "msg": "9b54825a-f432-5da2-9af3-f0de0547e28a",
     "at": "2026-09-14T11:40:05.000Z"
    }
   ]
  },
  {
   "ref": "o2",
   "kind": "wait",
   "label": "Lena's feedback on the photo layout",
   "line": "Lena is checking the new photo layout on her phone, and the release waits for her feedback.",
   "who": "Lena",
   "rank": 2,
   "raised_at": "2026-09-14T11:52:44.000Z",
   "msg": "7e2ab88a-2025-5232-bff5-83f041fbbe14",
   "evidence": [
    {
     "quote": "Lena is checking the new photo layout on her phone. I'll wait for her feedback before the release.",
     "kind": "prompt",
     "msg": "7e2ab88a-2025-5232-bff5-83f041fbbe14",
     "at": "2026-09-14T11:52:44.000Z"
    }
   ]
  },
  {
   "ref": "o3",
   "kind": "todo",
   "label": "Release photo upload",
   "line": "The release with photo upload waits for Lena's feedback on the layout.",
   "blocked_by": "o2",
   "rank": 4,
   "raised_at": "2026-09-14T11:52:44.000Z",
   "msg": "7e2ab88a-2025-5232-bff5-83f041fbbe14",
   "evidence": [
    {
     "quote": "I'll wait for her feedback before the release.",
     "kind": "prompt",
     "msg": "7e2ab88a-2025-5232-bff5-83f041fbbe14",
     "at": "2026-09-14T11:52:44.000Z"
    },
    {
     "quote": "Got it: the release waits for Lena's feedback on the layout.",
     "kind": "reply",
     "msg": "feadcd39-8a05-5916-9d19-a580b4fd1427",
     "at": "2026-09-14T11:53:20.000Z"
    }
   ]
  },
  {
   "ref": "o4",
   "kind": "wait",
   "label": "Shrink photos after the launch",
   "line": "You put off shrinking photos before they are saved until after the launch.",
   "when": "after the launch",
   "raised_at": "2026-09-14T12:01:09.000Z",
   "msg": "4fe14470-9223-50d7-8309-63f544324d97",
   "evidence": [
    {
     "quote": "Shrinking photos before saving would be nice, but let's leave that until after the launch.",
     "kind": "prompt",
     "msg": "4fe14470-9223-50d7-8309-63f544324d97",
     "at": "2026-09-14T12:01:09.000Z"
    }
   ]
  },
  {
   "ref": "o5",
   "kind": "todo",
   "label": "Sign up for the meetup demo",
   "line": "You want to demo recipe-box at the web meetup on September 20 and planned to sign up for a slot this week.",
   "due": "2026-09-20",
   "rank": 1,
   "raised_at": "2026-09-14T12:10:33.000Z",
   "msg": "fa5ccbc7-3002-564a-899e-b13f8b75ff2a",
   "evidence": [
    {
     "quote": "I want to demo recipe-box at the web meetup on September 20. I'll sign up for a demo slot this week.",
     "kind": "prompt",
     "msg": "fa5ccbc7-3002-564a-899e-b13f8b75ff2a",
     "at": "2026-09-14T12:10:33.000Z"
    }
   ]
  },
  {
   "ref": "o6",
   "kind": "todo",
   "label": "Delete a recipe's photo with it",
   "line": "Deleting a recipe should also delete its photo; it is not done yet.",
   "rank": 5,
   "raised_at": "2026-09-14T12:18:47.000Z",
   "msg": "6e3c17c2-65dd-5ba1-967a-f4a0419e345e",
   "evidence": [
    {
     "quote": "deleting a recipe should delete its photo too.",
     "kind": "prompt",
     "msg": "6e3c17c2-65dd-5ba1-967a-f4a0419e345e",
     "at": "2026-09-14T12:18:47.000Z"
    },
    {
     "quote": "It isn't done yet.",
     "kind": "reply",
     "msg": "3829adda-bb4b-5fbb-8ec7-05355c5c4674",
     "at": "2026-09-14T12:19:20.000Z"
    }
   ]
  }
 ],
 "close": []
}
