{
 "schema": "treesight/extract@1",
 "session": "e3b89c9b-bcf7-5ced-b376-1aab3e365f36",
 "through": "e39ab57f-4a03-5377-9e29-bdc2f8071b69",
 "nodes": [
  {
   "ref": "n1",
   "kind": "done",
   "label": "照片移到了存储桶",
   "line": "新照片存到存储桶，硬盘上原有的 37 张也拷了过去。",
   "score": 4,
   "at": "2026-09-23T09:19:52.000Z",
   "msg": "629ec575-9783-5d16-8b97-5873e2f3305b",
   "evidence": [
    {
     "quote": "老周把存储密钥发来了。",
     "kind": "prompt",
     "msg": "ad07faa5-d5f1-5c8a-bf5c-0c0421551bc5",
     "at": "2026-09-23T09:01:14.000Z"
    },
    {
     "quote": "照片现在存到存储桶了，硬盘上原有的 37 张也都拷了过去。",
     "kind": "reply",
     "msg": "629ec575-9783-5d16-8b97-5873e2f3305b",
     "at": "2026-09-23T09:19:52.000Z"
    }
   ]
  },
  {
   "ref": "n2",
   "kind": "done",
   "label": "1.2 上线了",
   "line": "你部署了 1.2，网站已上线，带照片上传。",
   "score": 5,
   "at": "2026-09-23T09:44:08.000Z",
   "msg": "20f4ba84-1a80-5fc9-ba02-e9f9a3ff54d4",
   "evidence": [
    {
     "quote": "1.2 已经部署，网站上线了，带照片上传。",
     "kind": "prompt",
     "msg": "20f4ba84-1a80-5fc9-ba02-e9f9a3ff54d4",
     "at": "2026-09-23T09:44:08.000Z"
    }
   ]
  }
 ],
 "open": [
  {
   "ref": "o1",
   "kind": "todo",
   "label": "写 1.2 发布公告",
   "line": "周五在博客上写一篇简短的 1.2 发布公告，重点是照片上传和照片正着显示。",
   "due": "2026-09-25",
   "rank": 1,
   "raised_at": "2026-09-23T10:20:15.000Z",
   "msg": "4fab755e-10d5-595d-9f6d-a0f2ef31708c",
   "evidence": [
    {
     "quote": "给 1.2 在博客上写一篇简短的发布公告吧。我周五写。",
     "kind": "prompt",
     "msg": "4fab755e-10d5-595d-9f6d-a0f2ef31708c",
     "at": "2026-09-23T10:20:15.000Z"
    },
    {
     "quote": "重点可以写照片上传，以及照片现在都能正着显示。",
     "kind": "reply",
     "msg": "b882cb4c-5eb3-512a-ac95-86f804bab289",
     "at": "2026-09-23T10:21:00.000Z"
    }
   ]
  },
  {
   "ref": "o2",
   "kind": "wait",
   "label": "阿杰的安卓测试",
   "line": "阿杰会用他的安卓手机测 1.2，你在等他的结果。",
   "who": "阿杰",
   "raised_at": "2026-09-23T10:35:40.000Z",
   "msg": "bcdf5d0c-4003-5402-8f7b-b7dc24541999",
   "evidence": [
    {
     "quote": "阿杰说可以用他的安卓手机测一下 1.2。等他的结果。",
     "kind": "prompt",
     "msg": "bcdf5d0c-4003-5402-8f7b-b7dc24541999",
     "at": "2026-09-23T10:35:40.000Z"
    }
   ]
  }
 ],
 "close": [
  {
   "id": "706417bf-o1",
   "status": "done",
   "sure": true,
   "quote": "老周把存储密钥发来了。",
   "msg": "ad07faa5-d5f1-5c8a-bf5c-0c0421551bc5",
   "at": "2026-09-23T09:01:14.000Z"
  },
  {
   "id": "706417bf-o3",
   "status": "done",
   "sure": true,
   "quote": "1.2 已经部署，网站上线了，带照片上传。",
   "msg": "20f4ba84-1a80-5fc9-ba02-e9f9a3ff54d4",
   "at": "2026-09-23T09:44:08.000Z"
  },
  {
   "id": "706417bf-o5",
   "status": "expired",
   "sure": true,
   "quote": "技术沙龙的演示我一直没报名，沙龙 9 月 20 日已经开过了，这件事就算了。",
   "msg": "2dda2fc4-290d-5984-ac10-28dd93131a7d",
   "at": "2026-09-23T09:50:31.000Z"
  },
  {
   "id": "706417bf-o2",
   "status": "done",
   "sure": false,
   "quote": "我记得小雨说排版在她手机上看着没问题，但我找不到她那条消息了。",
   "msg": "11238268-2cee-596f-8973-6eaafaee3380",
   "at": "2026-09-23T10:05:47.000Z"
  }
 ]
}
